ID,Name,Field,Description
1,Tony Robbins,Life Coaching,"Tony Robbins is a life coach who specializes in helping people achieve their goals, overcome limiting beliefs, and unlock their true potential. He uses a variety of techniques, including NLP, visualization, and goal setting to help his clients achieve success in all areas of their lives."
2,Marshall Goldsmith,Executive Coaching,"Marshall Goldsmith is an executive coach who works with CEOs, business owners, and other high-level executives to help them become better leaders. He focuses on developing leadership skills, improving communication, and enhancing performance, using a combination of coaching, feedback, and accountability."
3,Brené Brown,Personal Development Coaching,"Brené Brown is a personal development coach who helps people cultivate courage, compassion, and resilience. She is known for her work on vulnerability and shame, and she helps her clients develop self-awareness, emotional intelligence, and healthy relationships."
4,Deepak Chopra,Spiritual Coaching,"Deepak Chopra is a spiritual coach who helps people connect with their inner selves and find meaning and purpose in their lives. He draws on Eastern and Western philosophy, meditation, and mindfulness practices to help his clients achieve spiritual growth and wellbeing."
5,Simon Sinek,Leadership Coaching,"Simon Sinek is a leadership coach who helps people become better leaders by developing a clear sense of purpose and inspiring others to follow. He is known for his work on the ""Golden Circle"" and ""Start with Why"" concepts, and he helps his clients develop their own leadership style based on their values and strengths."
6,Susan Scott,Communication Coaching,"Susan Scott is a communication coach who helps people improve their interpersonal communication skills. She focuses on developing clarity, candor, and curiosity, and she helps her clients have more productive conversations, build stronger relationships, and create a more positive work environment."
7,Patrick Lencioni,Team Building Coaching,"Patrick Lencioni is a team building coach who helps organizations build cohesive teams and improve their performance. He focuses on developing trust, conflict resolution, commitment, accountability, and results orientation, using a combination of coaching, workshops, and assessments."
8,Laura Berman Fortgang,Career Coaching,"Laura Berman Fortgang is a career coach who helps people find fulfilling and meaningful careers. She helps her clients discover their strengths, passions, and values, and she guides them through the process of career exploration, job search, and career transition."
9,John C. Maxwell,Business Coaching,"John C. Maxwell is a business coach who helps entrepreneurs and business leaders grow their companies and achieve success. He focuses on developing leadership skills, strategic thinking, and organizational effectiveness, and he helps his clients overcome obstacles, take risks, and achieve their goals."
10,Martha Beck,Wellness Coaching,"Martha Beck is a wellness coach who helps people improve their physical, emotional, and mental health. She uses a holistic approach, focusing on nutrition, exercise, sleep, stress management, and self-care, and she helps her clients create sustainable habits and lifestyle changes."
